Created-At;From-User;Text;Id;Sentimen
02/11/2022 22.47;ra;Keluar anjir pihak dyandra global gak ada tanggung jawabnya banget, gedeg banget sama ini promotor https://t.co/d3bVnzIT7j;1,59E+18;Negatif
03/11/2022 13.15;JAKEY GF // free tag ?$TTC;@SMTOWN_JKT Dyandra global mantep Gini ya pelayanannya;1,59E+18;Positif
03/11/2022 22.48;sa ?;RT @RolandaHapsari4: @nct_menfess Dyandra global kayaknya yang sediain, coba liat reelsnya Dyandra global deh https://t.co/FiQj4VJ5jG;1,59E+18;Positif
03/11/2022 23.06;?????? ?;Dyandra Global udah bagus nih,, btw, yang gak nonton bisa numpang foto gak sih?? lucu banget LS raksasanya, pengin foto di situ,, https://t.co/P2tomwrXBK;1,59E+18;Positif
04/11/2022 06.50;Blibli Care;@johnnysuhcrush Untuk pemeriksaan bakal ada di area bag check ya kak, bisa dilihat denahnya di official IG dyandra global ^^;1,59E+18;Positif
04/11/2022 18.17;kumparan;Dyandra Global Edutainment juga mengatakan bahwa saat itu situasi di lokasi sudah aman terkendali, bahkan, tidak ditemukan adanya hal-hal yang mencurigakan. #kumparanKPOP https://t.co/C6XJsZVz6R;1,59E+18;Positif
04/11/2022 18.40;kumparan;Pihak promotor konser KPop @NCTsmtown_127, Dyandra Global Edutainment menegaskan, konser akan tetap berjalan normal, dan menyebut kabar terkait teror ancaman bom di lokasi konser adalah hoaks. #dailyupdate #4nov #oneliner https://t.co/lnKCQERZfb https://t.co/JLUgiFvIo6;1,59E+18;Positif
04/11/2022 22.44;Ida Ayu Dhama Tirtha Amrta;Lagian promotor ada-ada aja deh gak pakai QN, udah tau orang Indonesia suka nekat kalau tekadnya udah bulat @ Dyandra Global;1,59E+18;Negatif
05/11/2022 06.37;delik.news;Taeyong dan Doyoung Sempat Ingatkan Penggemar Tidak Berdesakan di Area Depan Panggung, Dyandra Global Edutainment Minta Maaf - https://t.co/Oj8DtCg5VS https://t.co/jvxyNQroWb;1,59E+18;Positif
05/11/2022 07.24;inilahcom;Promotor Dyandra Global Edutainment menyampaikan permohonan maaf atas dihentikannya konser NCT 127 2ND Tour “NEO CITY: JAKARTA – THE LINK” di ICE BSD City, Tangerang, pada Jumat (4/11) malam. Melalui laman Instagram, Dyandra menyatakan keputusan… https://t.co/IJhePgiFxa;1,59E+18;Positif
05/11/2022 08.13;Kompas.com;Kami meminta maaf untuk para penonton day 1 NCT 127 karena tidak bisa menikmati konser hingga akhir', kata promotor Dyandra Global. https://t.co/B04D6RiAXP;1,59E+18;Positif
05/11/2022 08.15;matamatadotcom;Beruntung tidak ada korban jiwa dalam kejadian tersebut. Dyandra Global Entertainment pun meminta maaf kepada penonton NCT 127 di hari pertama. https://t.co/mOp74vVoJQ;1,59E+18;Positif
05/11/2022 10.12;Kompas.com;Kami berharap untuk para penonton day 2 untuk dapat terus menjaga prosedur keselamatan selama acara', kata Dyandra Global, promotor konser NCT 127. https://t.co/DqlhxK1c6M;1,59E+18;Positif
05/11/2022 10.30;kumparan;Konser hari kedua NCT 127 di Jakarta akan tetap berlanjut sesuai jadwal yang sudah ditentukan. Informasi ini dibagikan langsung oleh pihak promotor Dyandra Global Edutainment di laman media sosial resmi Instagramnya. #focus #ricuhkonser #oneliner #nct127 https://t.co/LPdmPr15cs https://t.co/5dL3xvGWU8;1,59E+18;Positif
05/11/2022 10.54;Youth Suara Surabaya;Pihak Promotor Dyandra Global Edutainment menyampaikan permohonan maaf atas dihentikannya konser boygroup asal Korea Selatan tersebut.;1,59E+18;Positif
05/11/2022 14.11;?;@i99male Dyandra global beneran handle their job very well, penontonnya aja yang rusuh :(;1,59E+18;Positif
05/11/2022 14.26;detikhot;Dyandra Global Edutainment sebagai promotor konser NCT 127 2nd Tour ‘NEO CITY JAKARTA-THE LINK’ meminta maaf kepada semua pihak atas kejadian di hari pertama. Dan akan memperketat pengamanan untuk konser hari kedua. https://t.co/spTOGY8nL1;1,59E+18;Positif
05/11/2022 15.12;ubie;jujur dyandra global BAGUS banget servicenya, thank you . gue beneran diassist dari awal masuk gate sampai mau antri di queue line. Guardnya yang standby di festival section responsif tapi gak galak & rese, malah super sabar dan gak nyinyir. ?????????? @DyandraGlobal https://t.co/q6OdSBNhuR;1,59E+18;Positif
05/11/2022 19.08;syaaa| rest buy;oh ya thank you juga buat pihak dyandra global buat kerja kerasnya ngebujuk pihak sana sini demi kami, makasih juga buat polisi setempat karena udah mau menjaga kekondusifan konser day 2 ini THANK YOU;1,59E+18;Positif
05/11/2022 21.13;?;@DyandraGlobal THANK YOU SO SO SO MUCH DYANDRA GLOBAL & staf? makasih juga untuk polisi dan orang baik lainnya yang udah berkontribusi dan terlibat, thank you thank you thank you?;1,59E+18;Positif
05/11/2022 21.17;yiva?;Tapi jujur khawatir banget ke misse & dyandra global team. semoga selesai acara the link, any good things di setiap hari anda bakalan datang???;1,59E+18;Positif
05/11/2022 21.43;Rere?;@DyandraGlobal Thank you so so untuk Dyandra global team. terima kasih kerja kerasnya, acaranya seru sekali ? see u another project;1,59E+18;Positif
05/11/2022 22.04;?????;MAKASIH BANYAK BUAT DYANDRA GLOBAL, POLISI, SECURITY, DAN SEMUA staf???????????? https://t.co/Tc19E4WVNJ;1,59E+18;Positif
05/11/2022 23.12;Ann sudah ketemu Jaehyun ?;@DyandraGlobal terima kasih dyandra makasih banyak ??? terima kasih seluruh staf atas kerja kerasnya selamat istirahat ?;1,59E+18;Positif
05/11/2022 23.17;caca;sumpah THANK YOU banget DYANDRA!!!!????;1,59E+18;Positif
05/11/2022 23.19;?????;jujur keren banget dyandra, day2 semua langsung oke banget. thank you gitu. https://t.co/ktwnVTGNas;1,59E+18;Positif
05/11/2022 23.21;uty;dimulai dari antri jam 6.45 dibawah pohon rindang ini sampe jam 8.45, petugas dyandra juga tertib menanyakan antrian mana yang lebih dulu ke sijeuni, jadi semua adil https://t.co/P2RKFz3NR0;1,59E+18;Positif
05/11/2022 23.23;????;@Cipapapaw @_dnghyckieee bantu jawab. dyandra itu promotornya konser nct ini kak;1,59E+18;Positif
05/11/2022 23.23;aca;RT @NARyznn: NCTzen thank you untuk hari ini kalian luar biasa!!!!! ?Thank You Dyandra too!!!? Makasih kalian udah buat Member NCT 127 senang…;1,59E+18;Positif
05/11/2022 23.23;"????; marklee au ?";terharu!! KALIAN KEREN BANGETTT!!!! THANK YOU DYANDRA & NCT 127 ?? aku gak bakal berhenti ucapin makasih buat NCT 127, Dyandra, dan juga NCTZENS yang udah nurut sama aturan!!! KALIAN KEREN SEMUA KALIAN HEBAT ????????? &&&& SAFE FLIGHT JUGA buat member LOVE Y'ALL ???;1,59E+18;Positif
05/11/2022 23.24;Jung;RT @loey_jd: @roobiatul Loh sejak kapan dyandra pake qn? Dyandra gak pake qn dari dulu. Tapi konser yang udah tertib aja tuh gak kayak gini.;1,59E+18;Negatif
05/11/2022 23.24;M;ngeliat konser Day 2 tadi dan member beneran happy banget jadi seneng liatnya, terima kasih buat dyandra dan staf, para anggota kepolisian dan juga sijeuni yang sudah tertib dri awal acara sampai akhir. kalian semua hebat;1,59E+18;Positif
05/11/2022 23.25;KEPO;@DyandraGlobal gue bukan nctzen tapi I just wanted to say thank you. Team Dyandra gercep ngatasin lika-liku selama 2 hari ini. Jujur kalo masalah ini gak gercep diatasi mungkin indonesia bakalan di cap buruk dan dampaknya gak cuma 1 atau 2 idol lain.;1,59E+18;Positif
05/11/2022 23.28;hdgurlee??;konser hari ini lancar semua kok. fans juga aman gak sikut-sikutan gak angkat hp tinggi lebih tinggi lsnya karaokean bareng dan bisa joget-joget dan staf dyandra baik banget banget.;1,59E+18;Positif
05/11/2022 23.29;kanay;DAY 2 Alhamdulillah lancar aman tertib dan tentunya seru!!! Makasih dyandra, makasih sijeuni, makasih para staf, makasih buat semuanya yang udah terlibat, makasih juga buat illichil ????;1,59E+18;Positif
05/11/2022 23.32;ai¹?;@DyandraGlobal terima kasih JUGA DYANDRA KAMU KEREN HUA SAYANG SEMOGA GAK KAPOK YA KEREN POKOKNYA LOVE YOU???;1,59E+18;Positif
05/11/2022 23.34;alee?;@lov4rj Iya aku sabar gak papa biar aja dyandra menanggung dosa kita semua karena tersolimi?;1,59E+18;Negatif
05/11/2022 23.34;sepaa? ?? • freebies bets?;Gue akuin dyandra kali ini kerjanya bener. Gercep banget? kalo kemarin misal dipaksain tetep lanjut konser, gak tau deh bakal nambah berapa banyak korban:(( soon ada qn, sama harus lebih bagus lagi ya?? love you?? https://t.co/NcKiASlQ12;1,59E+18;Positif
05/11/2022 23.35;Mutia;tapi sumpah salut banget sama stafnya Dyandra. Gercep + ramah banget, sering bagi minum bahkan sampe masuk ke barisan bawa kardus minum. They help us a lot. Thank youuu???;1,59E+18;Positif
05/11/2022 23.37;THANK YOU URICHIL;@DyandraGlobal BIG THANK YOU FOR DYANDRA TEAM, terima kasih SUDAH BAWA BUJANG KU KESINI, SEMOGA KALIAN SEMUA LANCAR REZEKI DAN LEBIH BAIK LAGI YA!! jujur dari rumor bom itu, sumpah sigap banget!!!;1,59E+18;Positif
05/11/2022 23.41;zerrrrr??;BIG THANKS JUGA BUAT DYANDRA TEAM;1,59E+18;Positif
05/11/2022 23.41;rara kinda ia;special thanks to misse & dyandra and also polisi yang ngejaga supaya konser tetap tertib;1,59E+18;Positif
05/11/2022 23.42;Al;@DyandraGlobal terima kasih banyak Dyandra team. Walaupun aku belum berkesempatan hadir disana, tapi aku juga ikut seneng semua berjalan baik hari ini. Semangat terus ??;1,59E+18;Positif
05/11/2022 23.42;chressen;@DyandraGlobal terima kasih Dyandra, cowokku happy semua, urichill juga kelihatannya happy semua bahkan yang nonton di rumah kayak aku juga ikut happy;1,59E+18;Positif
05/11/2022 23.42;LEOYLIE;Gak mau muji cuma mau apresiasi aja karena untuk tahun ini DYANDRA memang the best lah karena penanganan hoax bom cepat sampe polisi juga turun tangan, lalu bertindak benar untuk menghentikan konser karena orang pada pingsan, dan memberi minum baik yang di dalam dan di luar.;1,59E+18;Positif
05/11/2022 23.43;Ester;@DyandraGlobal Thank you, Dyandra Global udah nambahin hari buat The Link. Meskipun tetep susah banget buat dapetin tiketnya, tetep thank you. Semoga kedepannya ticketing makin lancar, sama untuk standing dipakein QN. or even better, kalo semua section seating.;1,59E+18;Positif
05/11/2022 23.45;naluvv;@DyandraGlobal thank you dyandra! Jadi salah satu di day 1 yang kecewa banget gka bisa liat sampe perform abis, tapi gak akan kapok nonton lagi kalo yang bawa dyandra deh. Salah satu amaze adalah di sediain minum! Wait me for tds 2 ya!!!;1,59E+18;Positif
05/11/2022 23.45;markidi;@DyandraGlobal thank you so much dyandra team, big appreciation for today show! jujur dari fasilitas semua bagus staf sejauh yang aku temui semua ramah, show mulai pun crew rutin nanya nawarin air minum.;1,59E+18;Positif
05/11/2022 23.45;aruna nirac;semoga kalian sehat selalu bujang ilichil, promotor misse dyandra, dan para nctzen yang baik dan bijaksana. love y'all guys ?;1,59E+18;Positif
05/11/2022 23.46;markgeolli;@DyandraGlobal Thank you, Dyandra. Thank you, @missE konser hari ini (5 nov 2022) benar-benar bagus, efisien, tertib, dan gatau lagi deh pokoknya jadi best concert experience buat aku. Baru ini ngerasain konser yang rajin bagi2in minuman, gaada desak2an,;1,59E+18;Positif
05/11/2022 23.46;dheyy???;@nct_menfess THANK YOU DYANDRA!! SUMPAH KALIAN KEREN BANGET;1,59E+18;Positif
05/11/2022 23.48;Ev.Jiminski;congrats ya Dyandra kamu sebenarnya sudah sukses dari awal hanya karena situasi yang menghambat kemarin itu, ini namanya kesuksesan yang terhalang. tapi di malam ini kamu sudah membuktikan itu semua di mata kepalamu sendiri.. its real.. kamu BISA..?? hebat sayang. NCTZEN juga pasti bangga https://t.co/sRlnLVESTG;1,59E+18;Positif
05/11/2022 23.53;ra;@ciumanaja tapi dyandra emang bagus beda sama yang itu;1,59E+18;Positif
05/11/2022 23.55;Lulu;@DyandraGlobal Thank you dyandra!! Crewnya oke banget!!! Dan air putih dimana-mana ?? pokoknya bener-bener ga ada kurangnya asli nonton konser hari ini!! Udah pertama. Kali nonton konser kpop dan dikasih pengalaman yang luar biasa ?????;1,59E+18;Positif
05/11/2022 23.56;ye;Seneng banget makasih dyandra see u when i see u again urichil??;1,59E+18;Positif
05/11/2022 23.58;lalalovu;dyandra lu makin kece banget dah, makasih banyak ya https://t.co/WUm4x5g16b;1,59E+18;Positif
06/11/2022 00.10;Lil ?;Dyandra masih banyak masalahnya, tapi akhirnya yang trending ucapan makasih. Setelah pihaknya berani keluar dan ngomong langsung, jadi bisa mikir “oh they’re also trying, let’s loosen up for a while”;1,59E+18;Positif
06/11/2022 00.11;gal;@DyandraGlobal Aku ga nonton but thank you so much Dyandra!!!! Makasih banyak untuk staf, panitia, tim medis, security maupun polisi di belakang layar yang udah bekerja keras. Maaf atas kejadian yang tidak terduga di day 1 kemarin. You did well, selamat istirahat;1,59E+18;Positif
06/11/2022 00.14;lee;@nct_menfess makasih banget buat team dyandra, sepengalaman aku crew di lapangan super-duper baik dan friendly sabar banget terus setiap crew yang aku temuin entah untuk nanya atau yang lainnya pasti baik gaada yang jutek jadi kebawa happy aja karena crewnya baik??;1,59E+18;Positif
06/11/2022 00.17;az;@DyandraGlobal makasih banyak ya kakak dyandra, walaupun aku ga nonton tapi makasih karena udah usahain yang terbaik buat dua hari konser the link, we really appreciate it ???;1,59E+18;Positif
06/11/2022 00.19;ael;dyandra keren banget ?;1,59E+18;Positif
06/11/2022 00.25;git•;disamping masalah kemarin thanks to dyandra juga yang udah bawa ilichil ke indonesia, semoga di lain kesempatan kejadian kemarin bisa jadi bahan evaluasi buat kedepannya;1,59E+18;Positif
06/11/2022 00.25;wooh;truthfully speaking suka banget sama flownya dyandra, mereka bikin line per section dan belajar dari kemarin tadi ada crowd control crewnya di tengah2 penonton dan mereka sangat helpfull!! https://t.co/lQeWLfRGtU;1,59E+18;Positif
06/11/2022 00.31;?????;anyways, hari ini salut banget sama seluruh panitia / crew dari promotor the link jkt, Dyandra!! they did well today. semua crewnya tegas dan ramah bangettt. crewnya kesebar dimana-mana dan semuanya informatif;1,59E+18;Positif
06/11/2022 00.34;bilehh;@DyandraGlobal THANK YOUU JUGA DYANDRA UDAH BAWA ILICHILL;1,59E+18;Positif
06/11/2022 00.34;v?;@DyandraGlobal THANK YOU SO MUCH DYANDRA!!terima kasih ATAS KERJA KERASNYA!!??;1,59E+18;Positif
06/11/2022 00.36;?;@roobiatul iya dah orang-orang kenapa nyari kesalahan dyandra terus sih!!!! temen gue juga begitu dah, gak jelas. padahal dyandra udah bagus banget handle the link;1,59E+18;Positif
06/11/2022 00.47;fn ?;udah deh kpop artis semua sama dyandra aja kalo gini. crisis managementnya bagus, responsible sama semua stakeholder event juga ??;1,59E+18;Positif
06/11/2022 00.51;Peach N;Thank you dyandra the way kalian handle semua problem dari awal sampe akhir juga hebat banget, sampe dikasih voucher grab, dibagiin minum, dan staf nya ramah. Overall thank you buat @SMTOWN_JKT , @NCTsmtown_127 member, @DyandraGlobal, sekali lagi It was a great concert!! ??;1,59E+18;Positif
06/11/2022 00.54;ayangjepri;@DyandraGlobal Thanks kak and team, walaupun ga ikut nonton tapi dari berita-berita di timeline pasti susah banget buat ngurusnya, mulai dari ancaman bom dan sebagainya, hebat banget kak Dyandra and team bisa nanggepin ini dengan baik, dan alhasil day 2 bisa lancar;1,59E+18;Positif
06/11/2022 00.57;?;tapi beneran menurut aku dyandra udah keren banget handlenya, chaos kemaren juga karena oknum bukan salah promotor next kalau ada qn makin oke sih harusnya ???? https://t.co/IPZ7E9oQNO;1,59E+18;Positif
06/11/2022 00.58;nana;@DyandraGlobal THANK YOU SO MUCH KAK??? SAYANG BANYAK SAMA SEMUA staf DYANDRA?????;1,59E+18;Positif
06/11/2022 01.07;S?;@DyandraGlobal terima kasih Dyandra sudah membawa NCT 127 ke Jakarta dan terima kasih juga untuk semua yang berpartisipasi dalam konser ini??????;1,59E+18;Positif
06/11/2022 01.12;za | ? wts pc haechan & mark;RT @Mhyuvk: thanks to dyandra as well. Tbh untuk gue, konser hari ini sangat nyaman. Antre nyaman, nunggu holding nyaman, masuk venue nyaman.;1,59E+18;Positif
06/11/2022 01.13;càl;lets go promotor kuning bisa melakukan perubahan like them. big kudos to dyandra for gercep dengan segala yang harus diatasi segera. https://t.co/G4ypxaIFay;1,59E+18;Positif
06/11/2022 01.16;?tokkiki?;Pokoknya semuanya hebat!! Yang udah mau ikut peraturan hari ini dengan baik dan tertib. NCT 127 juga keren, tim dyandra juga, staf di baliknya apalagi. Keren keren ??;1,59E+18;Positif
06/11/2022 01.29;febi met haechan;stafnya dyandra keren semua, gue minta minum diambilin, minta tolong buangin sampah ditolongin, minta tolong fotoin juga difotoin, terus tadi gue ada ketinggalan totebag pas kelar konser tetep dicariin? keren banget kalian buat yang udah nolong gue makasih gitu ya?;1,59E+18;Positif
06/11/2022 01.30;nanaku?;@DyandraGlobal Sebenarnya aku masih sedih ga bisa liat encore gara-gara fans yang brutal, pengin nangis rasanya yaAllah jauh dari luar kota pertama kali konser?, karena ulah oknum fans brutal semua jadi kena imbasnya. Tapi gapapa semoga bisa menjadi pelajaran;1,59E+18;Negatif
06/11/2022 01.40;al;#TheLinkinJKT itu konser pertamaku. awalnya udah cemas duluan takut batal karena insiden day 1. tapi akhirnya kelar juga dengan aman tentram. SUMPAH dyandra responnya bagus banget buat ngatasin masalah yang ada.;1,59E+18;Positif
06/11/2022 01.50;?;Btw makasih buat dyandra, karena jujur kalian udah keren banget. Selalu ngasih minum di tengah-tengah konser, paramedis juga sat set , Cuma fansnya aja yang norak, mungkin next time keamananya boleh banget mentung orang yang udah ngrusuh;1,59E+18;Positif
06/11/2022 01.59;aling ?;@DyandraGlobal terima kasih banyak dyandra ???;1,59E+18;Positif
06/11/2022 01.59;Firina Sahara. N;RT @onyour_jmjn: Aku acungin jempol buat promotor dyandra dan misse https://t.co/mIJisRCFM9;1,59E+18;Positif
06/11/2022 02.14;paw?(?•?•?)?;please dyandra udah keren banget!!!!! thank you dyandra?? https://t.co/42aznrRjR5;1,59E+18;Positif
06/11/2022 02.15;Evelyn;Dyandra tuh dari dulu emang the best sih. https://t.co/aY0dJ5pLR5;1,59E+18;Positif
06/11/2022 02.15;cizi met 127?;Thanks for you too dyandra, i personally puas banget dari ticketing alhamdulillah dilancarkan sampai hari ini dan udah kena pcd aja ? https://t.co/6vq3oJAh6F;1,59E+18;Positif
06/11/2022 03.30;Mdy;@indogood_ @nct_menfess Dyandra Global kalo ga salah emang khusus artis Kpop deh cmiiw. Kemaren bawa Suju buat SS8. Pernah bawa Shinee dan TVXQ juga - yang pasti bukan pertama kali sih. Mereka akrab sama SM keliatannya.;1,59E+18;Positif
06/11/2022 03.54;Yuta’s OnlyFans;Thank you misse, thank you dyandra, thank you blibli, thank you polisi dan aparat, thank you semua yang udah berpartisipasi dalam membuat konser hari ini berjalan dengan lancar baik dari staf maupun para sijeuni? https://t.co/MXHqbkiPvR;1,59E+18;Positif
06/11/2022 04.19;a n i ?;Thank you Dyandra, sebelum konser banyak banget yang bilang managementnya jelek dll, tapi pas konser malah bagus banget sampe banyak bikin project adudu raksasa, photobooth dll??? https://t.co/8m7OfVcOJK;1,59E+18;Positif
06/11/2022 04.30;hÖnie slowresp;RT @Jhnfsx: Konser nct sama kickfest kemarin promotornya sama bukan sih? Dyandra? Kata fans nct dyandra bagus yang kacau penontonnya,;1,59E+18;Positif
06/11/2022 04.45;milan ?$TTC;dyandra ternyata gercep, ga seburuk mecima;1,59E+18;Positif
06/11/2022 05.07;????(sedih brutal);mending yang bawa dyandra deh, dari pada si mecima;1,59E+18;Positif
06/11/2022 05.24;?;btw ngeliat konser nct, terus dilihat dari penanganan dyandra keren deh satset. kejadian day 1 itu sih emang salah fans yang rusuh coba kalo ga rusuh pasti lancar aja sampe selesai.;1,59E+18;Positif
06/11/2022 05.35;chell;@nct_menfess @oohhongchii jujur dyandra.. keren banget:((( stafnya aduh parah selalu nawarin air ???;1,59E+18;Positif
06/11/2022 05.36;Nggi?;@DyandraGlobal Makasih banyak Dyandra keren udah datengin bujang2 aku. Walaupun ricuh di day 1, tapi gapapa deh;1,59E+18;Positif
06/11/2022 05.36;Nia *2 BADDIES ???*;terima kasih dyandra. Walaupun sedikit masih ada minusnya gapapa semoga bisa diperbaiki. Tp staf / crewnya baik² semua selalu kasih info yang baik kalo kita tanya. Sampe selesai acara aku ucapin terima kasih ke mereka karena udah kerja keras kasih yang terbaik buat aku dan fans2 lainnya. ? https://t.co/KUhmDNy4P2;1,59E+18;Positif
06/11/2022 05.40;Anindita;Sejauh ini kayaknya dyandra mau ada improve ya, sampe trendingnya Positif. Tapi emang mending sih daripada si kuning, kalo si kuning ticketingnya aja udah bikin emosi dan berakhir dengan dimaki-maki fansnya ???;1,59E+18;Positif
06/11/2022 05.50;Fififiuu;@nct_menfess Thank you dyandra. staf dan guardnya pada ramah dan asik. Mana perhatian banget ??;1,59E+18;Positif
06/11/2022 05.51;wa;sumpah ya, crew dyandra baik-baik banget sumpah;1,59E+18;Positif
06/11/2022 06.11;yaya;nah kalo kerjanya bagus kan responnya juga Positif ga kayak sebelah , thank you dyandra! https://t.co/16LadOLNg8;1,59E+18;Positif
06/11/2022 06.18;Nama tidak boleh kosong;RT @ziff312: thank you all! makasih udah tertib, makasih udah bikin member bahagia, makasih udah bikin kenangan indah sama mereka,;1,59E+18;Positif
06/11/2022 06.21;jaja ?;@nct_menfess Thank you Dyandra! You did a great job! Pertahankan kualitasnya ya! Next time coba terapin QN biar makin enak kita konsernya! Thank you so much ? @DyandraGlobal @missE;1,59E+18;Positif
06/11/2022 06.29;panggil aja pacar echan;@nctzenbase sumpah langsung netes air mata aku liatnya? dyandra thank you, you did well??? @DyandraGlobal;1,59E+18;Positif
06/11/2022 06.31;¶bunga;@DyandraGlobal very-very thank you for dyandra staf dan para pekerja lainnya yang bertugas menertibkan pas acara berlangsung. makasih atas kerja kerasnya sampe semua berjalan dengan lancar.;1,59E+18;Positif
06/11/2022 06.41;cha;Thank you illichil, thank you dyandra, thank you nctzen yang udah kondusif di day 2, thank you juga partner nontonku @skymarkiee so happy???????? https://t.co/dqp26LXGqb;1,59E+18;Positif
06/11/2022 06.51;dita;@DyandraGlobal Thank you Dyandra, konser kali ini pasti berat buat kalian mulai dari ancaman bom, day 1 ricuh, dibubarin dll, tp kalian bisa menangani itu semua dengan baik dan day 2 selesai dengan sangat baik. Jangan trauma ya :', Dyandra pasti bisa;1,59E+18;Positif
06/11/2022 06.57;piyuu kinda ia;big applause for dyandra, makasih ya day 2 bener-bener servicenya top banget, stafnya ramah https://t.co/QhtGnwl2PD;1,59E+18;Positif
06/11/2022 07.02;?;Big thanks, apesnya aku di day 1 kaget banget diberhentiin karena ga gampang dapet tiketnya. Kemaren lebih baik dari konser yang pernah aku datangi yang dipromotori sama dyandra kemaren anteng banget konsepnya bagus, banyak suguhan buat sambil nunggu waktu main gate dibuka. Next kayaknya better ga pakai ice lagi https://t.co/bfA3Z9BhuU;1,59E+18;Positif
06/11/2022 07.02;?? Fangirl & Personal Shopper | LOT79? | slow?;momen yang sejujurnya bikin nangis adalah waktu selesai konser dan mau keluar hall. staf dyandra ga berenti bilang “terima kasih ya kak “ ke kita yang nonton. kebayang burden mereka di hari kedua tuh segede apa karena 10 orang pingsan konser akan distop.;1,59E+18;Positif
06/11/2022 07.03;Anindita;@endangaarr Tapi diliat-liat kemaren mendingan kok si Dyandra. Baca igs katanya next event mau pake QN. Jadi kayaknya mending dia daripada si kuning, si kuning mah ga mau terima kritik jadi ga maju-maju;1,59E+18;Positif
06/11/2022 07.21;leaa??;@DyandraGlobal Dyandra thank you ya, pasti kalian udah kerja keras sampai day 2 tetap bisa dilaksanakan, thank you so much??????????;1,59E+18;Positif
06/11/2022 07.22;ara?~(????);eh tapi iya dyandra oke banget sempet dikasih break buat ditawarin minum ga lagi break juga ada aja mas-mas yang “mba minum ga mba tanya temen di sebelahnya”;1,59E+18;Positif
06/11/2022 07.27;markleecanada;Dyandra Nya mah udah oke banget, 1 hal yang ga terlupakan adalah stage dan stafnya baik dan ramah banget ? #THELINKTourJakarta;1,59E+18;Positif
06/11/2022 07.36;Hanum;terima kasih dyandra?? https://t.co/4eWFkqRGlY;1,59E+18;Positif
06/11/2022 07.36;Ayang Cikita;Salfok emang crew dyandra pada cakep-cakep;1,59E+18;Positif
06/11/2022 07.52;nadz ?.?;User, guard dan staf disana beneran ramah, baik dan informatif. Aku kebantu banget nanya-nanya mereka. Dijelasin secara detail. Ditawarin air terus pas konser jalan. 10+++++ ???????????? buat tim dyandra semuanya ???????? KEREN;1,59E+18;Positif
06/11/2022 07.58;Lilyana_Byeol;RT @13njmnchoco: bahagia banget untuk day 2 ini, terima kasih untuk semuanya, kerja kerasnya dan kerjasamanya karena bisa tertib.;1,59E+18;Positif
06/11/2022 08.01;Lilyana_Byeol;RT @yuhuuuu27: Thank you semuanya?? buat sijeuni yang udah tertib kalian keren banget? Buat semua staf terima kasih banyak sudah bekerja keras;1,59E+18;Positif
06/11/2022 08.06;IrzsaThecoconut;@DyandraGlobal Thank You banyak-banyak Buat Dyandra Global Kalian luar biasa dan juga MissE keren banget semua pokoknya Team kalian gercep juga menanggapi permasalahan pokoknya gaada yang bisa diungkapkan selain Thank you???;1,59E+18;Positif
06/11/2022 08.06;Ciyayociyayo;Akhirnya aku baru bisa masuk sekitar jam 17.38 karena harus gantian sama section lainnya, disini tertib banget staf dyandra pun super baik banget sampe senyumin dan semangatin kita bilang have fun ya nontonnya. Btw mereka juga bagi2 minuman ya aku ambil 2 https://t.co/VEh7ZfMntc;1,59E+18;Positif
06/11/2022 08.06;nanda ? ? ? ??.;Dah dah balik ges. Thank you Ilichil, chilzen, dyandra dan tempat penginapanku. Saya pamit pulang pengin pijet?? https://t.co/NSC8yzo7Ap;1,59E+18;Positif
06/11/2022 08.17;shaa?;@DyandraGlobal makasih dyandra, next harus lebih keren lagi ya. selamat evaluasi dan istirahat??;1,59E+18;Positif
06/11/2022 08.23;ell;@DyandraGlobal MAKASHI DYANDRA KALIAN KEREN BANGET!!;1,59E+18;Positif
06/11/2022 08.24;Jey | NOBAR NCT DREAM MOVIE On ?;RT @jaejiparkeu: big applause for dyandra, makasih ya day 2 bener-bener servicenya top banget, stafnya ramah;1,59E+18;Positif
06/11/2022 08.36;MayJination ?;Ticketing Nya dyandra lebih merakyat daripada mecimapro;1,59E+18;Positif
06/11/2022 08.40;Ulzaar;@DyandraGlobal terima kasih banyak Dyandra! Semoga kedepannya menjadi lebih baik lagi;1,59E+18;Positif
06/11/2022 08.45;??;Bahkan Dyandra udah jauh lebih baik dibandingkan waktu konser EXO 3 tahun yang lalu, gue aja sampe kaget.;1,59E+18;Positif
