Created-At;From-User;Text;Id;Sentimen
09/11/2022 10.40;markleecanada;@Arsela1109 @starfess coba kalo ada konfirmasi perjanjian coba kalo ada qn coba kalo penjagaanya kayak di day 2 pasti juga gaada tuh kejadian roboh kayak day 1 kamu ga ngerasain di day 1 kan ya ? aku disini juga ga sepenuhnya nyalahin dyandra aku cuma berkeluh kesah;1,59E+18;Negatif
09/11/2022 10.46;jheeee*hing?;@nctzenbase Suka sama staf2 dn pegawai2 nya Dyandra,ramah2 banget;1,59E+18;Positif
09/11/2022 10.53;indoapril;@nctzenbase aku gapapa dibawah dia cuma kalo boleh request mau tempatnya yang lebih gede jangan ice mulu,tapi katanya dyandra udah ada kontrak sama ice ya?;1,59E+18;Negatif
09/11/2022 10.55;nai;@nctzenbase dihimbau aja guys buat adain qn ke dyandra, soalnya biar ga keulang kayak the link banyak yang nginep, jam 3 subuh antrian udah sepanjang uler :'D;1,59E+18;Negatif
09/11/2022 10.59;.Adelee;@nctzenbase Dyandra jujur udah bagus, cuma emang standing bisa ditambah qn??? dan tolong tambahin stand snack box??? soalnya rame banget kayak mau antri minyak;1,59E+18;Negatif
09/11/2022 10.59;mars??? • fb hey;@nctzenbase Dyandra udah oke kok gapapa mantep;1,59E+18;Positif
09/11/2022 11.01;? ????;@xoxo_xtm iya sama-sama waktu itu di jiexpo standing semya terus kagetnya mereka pake cart gitu kelilingin stage nyamperin semua section the best dyandra walaupun waktu itu hujan2nan;1,59E+18;Positif
09/11/2022 11.05;putri?;@nctzenbase serius? gapapa, dyandra kemaren bagus kok dari stage dsb. yang penting banyakin stand makanan aja didalem (trauma antri sosis 3jam), sama kalo bisa all seating lebih ok sih;1,59E+18;Negatif
09/11/2022 11.09;dvna;@nctzenbase Amin tapi emang kalo sama itu yang bawa pasti dyandra kan, aku sempet baca waktu itu. Dyandra tuh bagus loh serius, cuma minus di qn aja;1,59E+18;Positif
09/11/2022 11.14;??;@nctzenbase Dyandra kemarin udah bagus kok, cuma berharap ada qn atau sekalian seating semua;1,59E+18;Positif
09/11/2022 11.17;bolubi;@nctzenbase Ya gapapa dyandra lagi soalnya kemaren oke, yang ga oke pada ngelanggar tapi ga ditindak, stand makanannya kurang yakali mau makan harus antri sejam mana sampe depan dah banyak yang abis. Terus kalo gabisa ngasih qn mending full seating ??;1,59E+18;Negatif
09/11/2022 11.24;subak;dyandra bawa dreamies lagi dong panggung, sound,lighting oke banget kalo dyandra;1,59E+18;Positif
09/11/2022 11.28;Kak Aje | WTS! Sharing NCT 2023 Season's Greetings;SUMPAH GAPAPA NANTI KALAU DREAM YANG BAWA DYANDRA ? Asal dikasih qn. Kemarin staf nya ramah ramah,, kemarin setelah pengecekan tas, punggungku di tepuk tepuk dipersilahkan buat lanjut ? kayak bapak yang lagi nyambut anaknya pulang ? https://t.co/HOfEoyOicu;1,59E+18;Positif
09/11/2022 11.32;hello, maly.| wts di pinned ya!;dyandra sangat recommended beneran tinggal tambah qn ?? https://t.co/i7cZok5StI;1,59E+18;Positif
09/11/2022 11.32;tir?;jujur aku setuju sih kalo dibawain dyandra, mungkin nanti tinggal dikasih QN aja udah bagus sih https://t.co/QMALYDpgBC;1,59E+18;Positif
09/11/2022 11.39;chal met sabujakz??;Tapi so far dyandra emang better sih dari mana2… minusnya cuma di qn… tapi overall semuanya oke..;1,59E+18;Positif
09/11/2022 11.41;macamacaroon;Gue sejujurnya gapapa deh dibawa dyandra lagi, soalnya the link kemaren tuh beneran keren banget sih cuma ya oknum itulah perusak day 1 https://t.co/jPqtAmGrFS;1,59E+18;Positif
09/11/2022 11.48;ana;@nctzenbase suka banget kalo dibawa sama dyandra lagi. dyandra cuma kurang QN selebihnya love? semoga ga di ICE lagi karena sinyal di sana subhanallah sekali ?;1,59E+18;Negatif
09/11/2022 11.49;pan ?????;@arwanostahw gapapa dyandra tapi kasih seating aja kalau ga kasih qn karena fans dreamies lebih bar-bar??;1,59E+18;Negatif
09/11/2022 11.53;tan cious?.?;dyandra udah bagus kok, pasti juga dia udah bisa improve dan dijadiin pelajaran yang kemaren. bisa jadi yang tds persiapan lebih bagus lagi, bisa ada di kasih minum dll pas konseran??? https://t.co/J2LOSQUJYB;1,59E+18;Positif
09/11/2022 11.54;?;@nctzenbase sumpah dreamies dibawa dyandra aja aku gapapa deh, tapi please adain qn buat standing atau kalo bisa all seating ?;1,59E+18;Positif
09/11/2022 11.55;chel;gue rasa ini mah udah fix bau2nya dibawa dyandra. sukses deh kedepannya https://t.co/E1qGAp9YV2;1,59E+18;Positif
09/11/2022 12.00;.;It's oke deh kalo tds2 dyandra yang bawa but, tolong all section di kasih seating aja terus ada QN biar ga antri2 dan tolong juga venue nya yang lebih besar jangan ice bsd ??;1,59E+18;Negatif
09/11/2022 12.09;nugu;@Gurlseche @nct_menfess Ga semua orang juga pengin yang jauh2? termasuk aku.. prefer 3 hari tapi venue nya ga segede gbk. Terus kalo dyandra emang udah ada kerjasama sama ice jadi bakal disitu lagi ujung2nya mau protes kayak mana juga:');1,59E+18;Negatif
09/11/2022 12.13;??;@cocobunzs Iya sih apalagi ice tuh kan jauh banget ya ? penginnya di yang dulunya bekas meis aja tapi katanya kalo dyandra yang bawa udah pasti di ice ya ???;1,59E+18;Negatif
09/11/2022 12.14;9;@aeribase dyandra bagus tapi gaada qn(takut pada nginep biar dapet tempat deket stage);1,59E+18;Negatif
09/11/2022 12.14;en.?;@aeribase gimana ya, sebenernya kalo buat tata panggung dan venue penonton dyandra nih super oke banget... tapi masalah ticketing sampe antri yang gaada qn itu yang sampe sekarang aku rada setengah hati sama promotor ini???;1,59E+18;Negatif
09/11/2022 12.14;jn;jujur gue gaada keluhan kalo promotornya dyandra lagi;1,59E+18;Positif
09/11/2022 12.15;istriceye ?;@aeribase Yakin pengin dyandra ?;1,59E+18;Negatif
09/11/2022 12.18;Lime;@aeribase Jangan lah, dyandra males bikin QN bikin orang pada nginep terus pas konser jadi pada pingsan deh;1,59E+18;Negatif
09/11/2022 12.18;???;Kan gue bilang apa:( dyandra mah udah bagus banget https://t.co/K3zNjvxPoR;1,59E+18;Positif
09/11/2022 12.19;div?;ya memang, dyandra biasanya kalo nonton konser kpop di luar indonesia berarti mereka yang bawa (ga semua tapi mostly begitu) https://t.co/Gp1OfjeaSi;1,59E+18;Positif
09/11/2022 12.20;fay;@aeribase Semoga kalau dyandra mereka udah ga males bikin qn?;1,59E+18;Positif
09/11/2022 12.21;??;@cccheesew @nct_menfess @DyandraGlobal Kalo di main studio GBK kayaknya ga bisa.. Paling bisa yang bekas EXO the lost planet 1 dulu. Itu juga luas. Kan promotornya juga katanya dyandra, yang venuenya sama kayak venue di Korea.;1,59E+18;Negatif
09/11/2022 12.25;??caca.88????;@aeribase jangan dyandra anjir?;1,59E+18;Negatif
09/11/2022 12.27;wts pink bets underprice;@kajjayorobun @aeribase dyandra gaada qn sih minus nya ?;1,59E+18;Negatif
09/11/2022 12.28;Hana ??•?•??;Gapapa kalo dyandra, kalo bisa ada QN, booth makanan juga yang banyak please ? https://t.co/qgkGFdMjzy;1,59E+18;Negatif
09/11/2022 12.29;nabila;aku mau deh kalo dyandra lagi dan ada qn please ? https://t.co/1HXYKng9mN;1,59E+18;Negatif
09/11/2022 12.31;ute ?;Aku beberapa minggu lalu misuh promotor di indonesia gaada yang bener, tapi setelah ngerasain dyandra global wow mereka bagus banget ?;1,59E+18;Positif
09/11/2022 12.31;Chi?;Tapi sumpah gue berharap tds jakarta dibawa sama Dyandra.;1,59E+18;Positif
09/11/2022 12.32;nabila;So far puas sih sama dyandra. Konser nct kemaren bagus banget banget, orangnya baik2, venue oke dan semua rapi kok. Emang ada fans yang rese aja pas day 1. Buktinya pas day 2 aman-aman aja. Minusnya gaada qn aja sih mangkannya banyak yang antri dari pagi;1,59E+18;Positif
09/11/2022 12.33;Yumark2402;@nctzenbase Cuma trauma ticketing aja sama dyandra;1,59E+18;Negatif
09/11/2022 12.34;Ayaa.;Gapapa Dyandra lagi yang bawa. Tapi tolong QN dan SEMUA SECTION SEATING. Terus itu tolong booth makanan & toilet agak diperbanyak ya.. soalnya kemaren antrinya lama banget? dah sih, selebihnya dah bagus https://t.co/3rU1Gj5ZHk;1,59E+18;Negatif
09/11/2022 12.34;???;@aeribase Dyandra kalau masalah panggung tuh oke banget, tapi mungkin ada beberapa kurang srek. Tapi pengin banget 2 hari ? ( bahkan permintaan ini exo sendiri yang minta );1,59E+18;Positif
09/11/2022 12.34;?sami ¹¹??????;bismillah dyandra https://t.co/Zoeovu8Vfn;1,59E+18;Positif
09/11/2022 12.36;?? ? ??;Dyandra next konser juga mending pake qn dah kataku;1,59E+18;Negatif
09/11/2022 12.40;venn??;@aeribase Kalo dyandra pake qn aku gas. Tapi kalo ga pake, aku rela exo dibawa si kuning anjir;1,59E+18;Negatif
09/11/2022 12.42;sasa;So far dyandra bagus sih, cuman banyak yang bilang minus di ticketing sama qn ya? Harga tiketnya juga oke banget. Gapapa besok tds Dyandra lagi, semoga aku bisa nonton juga ? https://t.co/BAhydhalFb;1,59E+18;Positif
09/11/2022 12.44;aoll;@aeribase Semoga kalo dyandra pas bawain exo planet 6 full seating yah, jadi gaada standing terus di qn semua;1,59E+18;Positif
09/11/2022 12.44;sasa, @ after dm;Dyandra kalau bawa dream pasti tiket ga jauh jauh banget harganya kan. Mana termasuk murce, paling murah aja 1jt;1,59E+18;Positif
09/11/2022 12.47;LilyMagnolia;@aeribase Gatau ya pengalaman gue sama dyandra maupun mecimapro not bad kok keduanya, cuma tiket aja yang ribet, yang terakhir exploration itu sampe kecheckout 100 tiket apa gitu ga ngerti, begitu mau 1 sold out....???;1,59E+18;Negatif
09/11/2022 12.50;xxxds;@nctzenbase Menurutku gapapa banget, dyandra kemarin udah bagus kok, layar nya juga mantep banget gede. Mungkin bisa kasih qn aja buat next konser sama tambahn booth snack, karena gila kemaren lama bener buat antri makanan??, dan berending gajadi beli karena habis;1,59E+18;Positif
09/11/2022 12.51;adapasi;@aeribase Jujur aku sih untuk saat ini prefer dyandra tetep yang bawa exo, paling minus nya bagian tiketing + qn. Jangan sampe kejadian kemaren pas the link terjadi salah satunya ada tiket yang udah dituker padahal orangnya masih di malaysia.;1,59E+18;Negatif
09/11/2022 12.51;adapasi;@aeribase Tapi kemarin jujur udah oke sih dyandra daripada mecimapro Aku denger denger dari orang ya begitulah.;1,59E+18;Positif
09/11/2022 12.54;Thank you for being a strong and great human being;@aeribase tapi, ya, Dyandra juga bisa dibilang salah satu promotor yang oke sih dari Indonesia (cintai produk lokal). Dari lighting, stage EXO pas tampil saat itu, dan sound systemnya juga sebenernya bagus. Kemarin juga pas NCT dibawa Dyandra kan ya? Bagus;1,59E+18;Positif
09/11/2022 12.55;a n a ?????;Jujur aja sebenernya gue juga lebih suka dyandra daripada mecimapro soalnya kalo yang sebelah jual tiketnya drama banget membership dll, tapi tolong banget nih dyandra sayang pake qn yuk, apa all seating juga oke https://t.co/ZvFJVEXhsW;1,59E+18;Positif
09/11/2022 12.56;nolaniii;@aeribase kayaknya idol SM langganan dyandra ga sih. tapi gatau lagi kalo nanti. terlepas adanya kekurangan ini itu, semoga jadi bahan evaluasi buat kedepannya. apalagi masalah qn;1,59E+18;Negatif
09/11/2022 12.57;cha?;@aeribase masih berharap sama pake promotor sendiri sih, dyandra kemaren ada masalah juga qn, plus semoga seating semua;1,59E+18;Negatif
09/11/2022 12.58;r | sharing exo season greeting ??;@aeribase bener dyandra udah bagus sekarang minus di qn sih emang (review kemaren abis nonton nct);1,59E+18;Negatif
09/11/2022 12.59;?;@nctzenbase Semoga iya. Dan koreksi untuk dyandra semoga ada qn dan all section dibuat seating;1,59E+18;Negatif
09/11/2022 13.02;??/kangen suho;Dyandra udah Bagus sih menurut ku kemaren, penanganan nya juga ga bertele tele staf nya ramah ramah cuman kurangnya gaada qn buat standing kalo bisa mah all seating aja semua ?? https://t.co/W9iO1AhXNV;1,59E+18;Positif
09/11/2022 13.07;LilyMagnolia;@littlejaesix @aeribase Gue waktu dyandra adu mulut aama petugas booth karena jam 7 penukaran tutup di IG Dyandra,tapi petugasnya jam 6 dah mau tutup booth, jadi ribut aama petugas + jastip gue kesel banget sumpah,masih ada di LINE gue emosi sumpah https://t.co/NLuRcsK312;1,59E+18;Negatif
09/11/2022 13.12;sya k/ia ?;ayo dyandra bawa dream lagi jujur pas the link kemarin dyandra udah bagus tapi jangan lupa QN + kalo mau ice bsd lagi minimal 3 hari ya ?? https://t.co/PaoOrnls2O;1,59E+18;Positif
09/11/2022 13.14;?;masalah dyandra tiap konser memang cuma di tiket sama memanusikan antrian, tapi sekarang kayak kemaren udah oke konsep antrinya the link. Semoga begitu terus ke depannya. https://t.co/Rzg7QFe8vu;1,59E+18;Negatif
09/11/2022 13.19;kek ?;"Kataku sih gapapa dyandra lagi kemaren udah oke waktu di venue cuma tinggal kasih qn + ticketingnya jangan banyak yang ghoib ;-; https://t.co/E7mLF8H0Cq";1,59E+18;Negatif
09/11/2022 13.21;LilyMagnolia;@Nop_Kyungsoonaa @aeribase belom ikut konser lagi sejak exploration dan pandemi, suka duka banget lah jastip juga, takut ditipu, padahal pengin war sendiri tapi kehabisan baru semenit 1000 tiket kecheckout ampun ampun, jaman dyandra dulu ngamuk2 semua pas ticketing;1,59E+18;Negatif
09/11/2022 13.25;shining Loey???;@aeribase gatau deh, dyandra waktu ep 5 ngeselin parah staf nya dan gaada qn juga kan, tapi untuk war ticket ga ribet. gatau deh. kira2 tiket nya exo berapa ya nanti? waktu grup lain masih 2.5an, exo udah 3.3 anjir???;1,59E+18;Negatif
09/11/2022 13.36;pacarnya echan;dyandra ticketingnya kacau banget pas exo. mecimapro stagenya jelek2 anjir. tapi siapapun yang bawa semoga aku dapet tiketnya https://t.co/BUDVM4P9rd;1,59E+18;Negatif
09/11/2022 13.42;Co0kies;@aeribase jangan dyandra lagi, 2019 kan udah ada contohnya;1,59E+18;Negatif
09/11/2022 13.44;Rins;boleh aja sih dyandra lagi kemaren juga udah oke cuma untuk mengurangi orang2 yang nginep dan antri dari subuh emang butuh qn dan snack bar nya dibanyakin lagi please antri beli makan aja sampe 2 jam https://t.co/u6n7cc0RZW;1,59E+18;Positif
09/11/2022 13.44;Fauziah Hamidah;RT @haaanchooo: @aeribase, sebenernya kalo buat tata panggung dan venue penonton dyandra nih super oke banget...;1,59E+18;Positif
09/11/2022 13.45;venn??;@alwaysstay0325 @aeribase iya kak. ga sanggup kalo harus antri qn dari pagi kayak dyandra??;1,59E+18;Negatif
09/11/2022 13.49;???;@kajjayorobun @littlejaesix @aeribase bener, tahun sekarang mending dyandra benefitnya banyak walaupun kurang di qn. kemarin pengalaman nonton the link;1,59E+18;Positif
09/11/2022 13.53;30;@aeribase tapi dyandra venuenya selalu 'cari aman', ga berani venue yang besar kayak di stadion;1,59E+18;Negatif
09/11/2022 13.57;? ?ZSUVKERMAN? ?KANG SKY;Dan promotor yang gue kenal first time emang dyandra sih https://t.co/uN8Ov5LG7E;1,59E+18;Positif
09/11/2022 14.06;baduuuttzzz;@aeribase yakin mau dyandra? padahal pas 2019 kacau ticketingnya, belum lagi ga pake qn;1,59E+18;Negatif
09/11/2022 14.07;zoey´?`;@aeribase kok ada yang mau dyandra;1,59E+18;Negatif
09/11/2022 14.35;Fani ??;Dyandra udah bagus kok kemaren pas the link. Tinggal nambahin qn, perbanyak snack bar sama perbanyak toilet. Udah itu aja menurut gue. Sama kalau lebih bagus berani all seating. Udah rapih aman tentram jaya sentosa itu mah https://t.co/uLKfZtCVRe;1,59E+18;Negatif
09/11/2022 14.49;? Rara??? ?;@aeribase Prefer applewood sih … dyandra ga suka nya karena gaada sistem qn, itu amat sangat ga banget ??;1,59E+18;Negatif
09/11/2022 15.07;-ki-;@limerencelns @aeribase Emang dyandra kurang sih masalah QN, tapi kalo nginep itu kan pribadi masing2 ya. Udah di himbau juga buat ga nginep tapi pada bandel. Ga sepenuh nya salah dyandra sih kalo masalah yang pada pingsan karena nginep;1,59E+18;Positif
09/11/2022 15.33;gitaa;@aeribase mecimapro sama dyandra sama-sama ada minusnya sih;1,59E+18;Negatif
09/11/2022 15.33;Fik | freebies the link?;@schatzric Betul, dyandra better banget daripada mecima;1,59E+18;Positif
09/11/2022 15.36;issacacty?;dyandra my love. itu panggung 6m akan selalu gue inget karena konser pertama gue juga dyandra lu oke banget, minusnya cuma ga ada qn. 2019 pun ga ada masalah kayaknya https://t.co/boi1Eb9QPE;1,59E+18;Positif
09/11/2022 15.43;??;Kenapa sih pada ga mau di ice? Ice enak kok. Tapi dyandra pasti di ice sih soalnya udah ada kontraknya. Terus juga qn emang sengaruh itu ya? Paling ngaruhnya cuma buat orang2 yang ngincar mepet pagar. Biar tertib? Ya itu mah tergantung penontonnya dan kalau udah didalem ada qn juga ga ngaruh https://t.co/ykwt6Z9nbL;1,59E+18;Negatif
09/11/2022 15.45;Catelyn.;asli gapapa kalau dyandra lagi, asal ada qn aja sama pas ticketingnya gaada kendala kayak kemarin nct 127 & exo. ??? https://t.co/sejUdtyS9m;1,59E+18;Positif
09/11/2022 15.46;da.;@genkisusky UDAH GABISA NGOMONG LAGI AKU bisa-bisanya udah mau copot gitu gaada security anjir emang dyandra lalai banget, bisa-bisanya kekurangan orang hadeh mereka yang kekurangan tapi kita gaboleh marah2?;1,59E+18;Negatif
09/11/2022 15.54;Tenggg.;@nct_menfess lah emang bakal dyandra lagi kan yang bawa ((': pokoknya mah intinya QN ya;1,59E+18;Negatif
09/11/2022 16.11;Nins;@nct_menfess aku ga nonton 127 kemarin tapi aku terkesan sama sistem Dyandra. Mungkin kalau beneran TDS2 promotornya Dyandra lagi, tolong seating aja ya @DyandraGlobal . Katanya kan mau improve buat next konser;1,59E+18;Negatif
09/11/2022 16.17;ale | cmh1 is coming?;@noviantirizanni mecima selalu dapet kok, beda sama dyandra. selama konser & ticketing dari mecima, even yang standing dikasih nomor antrian jadi ga perlu ngantri dari pagi. di semua platform mau tiket atau mecimashop gitu.;1,59E+18;Negatif
09/11/2022 16.42;gal??•??•??;@abcaskz @sekalium @Jeproyko @nanacmol @nctzenbase aku tetep pake harga the link untuk perbandingan harga tahun ini apalagi udah ada desas desus dream bakal dibawa sm dyandra juga kan https://t.co/ZteX396x4p;1,59E+18;Positif
09/11/2022 16.47;JAEHYUN’S DIMPLE;Dyandra kemarin tuh udah bagus asli, tinggal qn please ? biar orang2 ga nyubuh yaallah , sama snack barnya sih, kemarin nasi goreng 65K mubajir banget yaallah , nasinya ga mateng https://t.co/eVi5uNHkCA;1,59E+18;Negatif
09/11/2022 16.50;tan cious?.?;@_jeongjae77 dyandra bagus sih kemaren tuh mana ada banyak photobooth gitu jadi banyak buat foto2, pasti kedepannya juga dia bakal improve setelah kejadian yang day 1 itu pasti biar mengurangi orang yang pingsan2 ya di sediain minum meskipun cuma gelasan gitu,;1,59E+18;Positif
09/11/2022 17.04;call me;@bucinoppa_ @senomined @nct_menfess Bisa jadi ga goyang . Kuning kemaren goyang kalo kata temenku . Dia aja sampe ga berani berdiri pas konser . Kalo liat aturan seatingnya bagus dyandra . Dia per kursi naik undakan gitu , kalo kuning per 2 kursi baru naik .;1,59E+18;Positif
09/11/2022 17.52;Fluttershy;@nctzenbase setelah the link kemaren aku suka sih sama sistem dyandra maybe yang perlu diperbaikin stan makanannya aja karena ada banyak orang tapi stan makanan sedikit dan ga boleh bawa makan dari luar yang jual nasi juga ga begitu banyak;1,59E+18;Positif
09/11/2022 18.21;andien;dyandra kalo mau bawa dream gapapa cuma tolong ya tambahin qn kalo bisa mah seating semua aja belajar dari kemaren sama booth snack please kemaren kayak antri sembako pemerintah panjang 2 jam ngantri beli makan doang bajingan? https://t.co/yHu3e0PTAb;1,59E+18;Negatif
09/11/2022 18.22;mimi ?;Tapi gue berterima kasih banget sama dyandra udah ngundang mereka kesini, kalo ga nct kedua kalinya ga ke indonesia;1,59E+18;Positif
09/11/2022 18.25;mira;@nctzenbase Aku sih yes ya. Dyandra lebih komunikatif, aku suka;1,59E+18;Positif
09/11/2022 19.07;Iyya?;@hellowidss Kalo pun dibawa dyandra semoga lebih proper dari evaluasi day 1 kemarin???;1,59E+18;Positif
09/11/2022 19.45;?pu??;jangan dyandra lagi lah, emang mau nanti ada sistem 'jatah ordal' lagi kayak dulu? wkwk https://t.co/MvMArc8zFG;1,59E+18;Negatif
09/11/2022 19.48;ran;kata bapak satpam dyandra smtown tahun depan ?;1,59E+18;Positif
09/11/2022 20.10;Cory Juliana;@jstletitbe @aeribase Dyandra juga promotor yang kemaren. Gue salah satu korban keganasan kala itu ????;1,59E+18;Negatif
09/11/2022 20.19;dew;@daelionie @ness_ngel72 @aeribase kalo calo sekarang dyandra udah mulai tobat kok soalnya the link day 2 ga ada calo samsek, ordal dyandra juga ga dikasi jatah tiket dan ticketing dyandra kemarin sempet dipuji. terus antriannya juga rapi;1,59E+18;Positif
09/11/2022 20.34;NANA;@aeribase semoga pake qn ?? kalo calo-caloan kayaknya dyandra udah ga ya?;1,59E+18;Positif
09/11/2022 21.06;May;@aeribase Jujur aku lebih suka dyandra daripada mecima. Udah 2 kali sama dyandra (exo planet 5 dan the link) please mecima kamu bawa exo lagi ya??;1,59E+18;Positif
09/11/2022 21.07;Nda~;@aeribase @urfavtata kayaknya mending dyandra deh dibanding mecima itu;1,59E+18;Positif
09/11/2022 21.17;Noir;@aeribase Jujur dyandra emang minus di qn sih. Lighting juga oke. Cuma sayang banget waktu itu pas musim hujan, kena outdoor, menit2 terakhir ujan gerimis. Sampe chanbaek kegerimisan. Gue festival F, lumayan juga ngantrinya, hair extention gue sampe copot;1,59E+18;Negatif
09/11/2022 22.20;Bee ??;@aeribase Aku malah gamau dyandra lagi :') pengalaman explo kemarin gaada qn buset kayak mau mati gue mau masuk ke vanue aja ?;1,59E+18;Negatif
09/11/2022 22.30;????? open tarot readings;Dyandra sekarang bagus tenang aja https://t.co/ar0YA1mEwv;1,59E+18;Positif
09/11/2022 23.09;hellowien_17;@mongsdhel @haaanchooo @aeribase Setuju sebenarnya Dyandra cukup oke tinggal dibenahi di ticketing Kalau bisa ada QN nya , fanservice nya ke customer kalau bisa ditambah lagi ,kalau ada member yang special day Bisa lah lebih baik lagi kasih projects apa gitu;1,59E+18;Negatif
10/11/2022 00.21;Dita Fadilla;sebelum mulai konser polisi sama pihak dyandra nya ngeinfoin kalo ga kondusif konsernya dijeda dulu, sedangkan polisi nya bilang kalo yang pingsan 10 orang konser di berentiin kayak day 1, kebayang ga 8rb orang lebih dibanding 10 orang;1,59E+18;Positif
10/11/2022 01.20;puuchan??;@aeribase hati-hati kalo ngomong. Pas EP1 dyandra cuma kasih 1 gate masuk buat semua gate dan itu lama banget aku ngantri dari jam 9 pagi buat nuker tiket, jam 12 baru dapet tiket, terus langsung ngantri masuk venue dan jam 5 sore baru bisa masuk venue;1,59E+18;Negatif
10/11/2022 02.04;vir;your feeling valid kok, untuk merasa kecewa dan sedih. but talk about the compensation, itu bukan dari dyandra. mereka bahkan sampai sujud untuk mohon-mohon agar tertib di hari selanjutnya. disini mereka juga dirugikan, karena pasti ngaruh ke reputasinya — https://t.co/bg2cSQl1PY;1,59E+18;Positif
10/11/2022 02.05;vir;— konser dibubarkan karena “kerusuhan” sampai barricade rubuh. i think kalo ga rubuh itu bisa tetep lanjut… ini udah banyak yang pingsan rubuh pula. soal himbauan, dyandra udah kasih himbauan di tnc. soal angreement mereka dan polisi di konser manapun pasti ga dijelasin itu. https://t.co/n1vmNzuWGK;1,59E+18;Positif
10/11/2022 07.27;martabak telur;@aeribase tapi dyandra juga waktu EP5 berantakan banget.....?;1,59E+18;Negatif
10/11/2022 08.03;Miju;Jujur aku gapapa banget dyandra tapi please 2-3 hari karena emang ICE agak kecil venuenya ? https://t.co/NvZOT0BMQ4;1,59E+18;Negatif
10/11/2022 09.53;gR;@nctzenbase Gapapa banget sih,dyandra kemaren udah jauh lebih baik,lebih baik lagi kalo all seat,yuk bisa yuk??;1,59E+18;Positif
10/11/2022 09.59;??????;Ini konser pertama aku sama Dyandra.. emang gaadaQN ada yang antri dari jam 12 malem.. tapi tertib ? .. ga ada gencet2an juga .. cuma ya karna outdoor hujan panas dirasain ? .. stagenya secakep itu, karena member keliling banget dan sisi manapun enak viewnya.. https://t.co/fw7rLCX3BX;1,59E+18;Positif
10/11/2022 12.10;Sya;Sumpah Dyandra kalau TDS 2 banyak photo boothnya, GUE DATENG PAGI.;1,59E+18;Positif
10/11/2022 12.34;Dwi ??;jujur usher dyandra tuh the best banget???;1,59E+18;Positif
10/11/2022 12.42;jeno bin mail;Karena kejadian we all are one, gue mending ama dyandra aja lah. Please misse bawa dream nya sama kamu aja ya?;1,59E+18;Positif
10/11/2022 13.35;Giwangkaradotcom;Buntut Dibubarkannya Konser NCT 127 Akibat Ricuh, Dyandra Global Edutainment Panen Kritik dari Fans.. https://t.co/kLneLjGWBN;1,59E+18;Negatif
10/11/2022 16.40;post concert trauma #TheLinkinJKT_Day1;@renny_noona @nctzenhumanity Semoga aja dyandra juga tapi dikasih QN;1,59E+18;Negatif
10/11/2022 16.52;Renn'????;@hananarkanata @nctzenhumanity kalo aku sih kalo ada yang lebih baik yang lain aja deh?kalo gabisa seating semua ya minimal QN lah, kalo emang jodohnya TDS tuh dyandra semoga mereka banyak belajar dari the link kemaren, harapanku itu aja sih??;1,59E+18;Negatif
10/11/2022 20.04;belle;apalagi yang mic dia lepas itu beneran semuanya cuma ngakak' aja but ya meskipun ini minor i think tapi karena ini performances yang harusnya bisa lebih diperhatiin sih tapi overall jujur suka sama service dyandra tahun ini;1,59E+18;Positif
10/11/2022 20.43;sheen;tds beneran dyandra lagi?? semoga bener?????;1,59E+18;Positif
10/11/2022 21.42;johsam;@cikicikupawpaw dan gue denger dari temen gue (crew disana) manager 127 marah2 ke dyandra, sujudnya dyandra di day2 itu udah sujud kesekian kalinya setelah mohon2 buat day 2 tetep diadakan, karena staf SM udah ga mau…;1,59E+18;Negatif
11/11/2022 04.17;bella on poppy lockdown;mau bilang makasih banget ke dyandra karena udah berusaha banget biar day 2 tetep diadain ??? https://t.co/rC90H53VrC;1,59E+18;Positif
11/11/2022 11.03;??? ?;Yang harus bertanggung jawab disini adalah si pihak promotor, kenapa bisa konser di berhentikan sepihak tanpa ada omongan apapun dengan pihak SM. Dan yang lucu nya yang ngebubarin itu malah si translator nya bukan MISSE selaku perwakilan dari dyandra.;1,59E+18;Negatif
11/11/2022 11.04;akun healing;Besok kalo the dream show yang bawa dyandra gapapa deh semoga harganya ga jauh beda sama the link ?;1,59E+18;Positif
11/11/2022 11.05;?;Semoga tds nanti dyandra dah wanti2 tentang ini lagi, please lah pantau aja ini section bagian depan main stage. Biar the link aja yang kayak gini, konser lain jangan :(;1,59E+18;Positif
11/11/2022 11.13;ris ia;@mcdpilihanku @cikicikupawpaw lah lagian lu emang masih anak kecil? perihal jangan rusuh, jangan dorong”an, jangan yang lain lainnya perlu dikasih tau dulu ya? syarat dan ketentuan ada dan dibuat untuk dipatuhin, jangan giliran rusuh nyalahin nya dyandra.;1,59E+18;Positif
